{
  "event_id": "f67e13a0-36f1-46d2-b1fb-d4d4b0ebc938",
  "event_type": "capture_and_extract",
  "entity_id": "d424883c-28a7-40d2-8e18-f1b5927c8619",
  "agent": "arwen-policy-etl/0.1.0",
  "input_ids": [
    "41650a5bbaf09e2be2635f9dd494ee692fbf92f131ce9979e21341ff84f52c6b"
  ],
  "attributes": {
    "requested_url": "https://www.intgovforum.org/en/content/about-igf",
    "final_url": "https://www.intgovforum.org/en/content/about-igf",
    "capture_status": 404,
    "etag": null,
    "last_modified": null,
    "extraction_method": "html_bs4",
    "metadata": {
      "title": "Page not found | Internet Governance Forum (IGF)",
      "language": "en",
      "summary": null,
      "published_at": null
    }
  },
  "timestamp": "2026-08-10T06:34:37.267652+00:00"
}
