{
  "event_id": "4c2efb32-bf4a-41f3-a00d-061328d893a4",
  "event_type": "capture_and_extract",
  "entity_id": "d729188d-cf29-4f4c-bc98-07d1199ffbad",
  "agent": "arwen-policy-etl/0.1.0",
  "input_ids": [
    "8dcfacf85092fa368f872f018c93d3ff25b7625c1e43d3e06f25d276d67857d0"
  ],
  "attributes": {
    "requested_url": "https://account.icann.org/authorize?redirect_uri=https://www.icann.org/oauth&client_id=0oa9o9k9rp8VUcyJL2p7&nonce=6f5398ba-8a62-4370-99a8-e00d981b692d&state=https://www.icann.org/",
    "final_url": "https://icann-account.okta.com/sso/idps/0oa1onjgxe0rOvxPR2p7?stateTokenExternalId=eXRyMGFIcjBxRTduMHVNREt4a1FTMkZ6alZQU2tnNUp2aFUvL01pR0R5dTduNXVyb1lyWmQ5U01qR1BqK2NtWA",
    "capture_status": 200,
    "etag": null,
    "last_modified": null,
    "extraction_method": "html_bs4",
    "metadata": {
      "title": "Icann-account - Signing in...",
      "language": "en",
      "summary": null,
      "published_at": null
    }
  },
  "timestamp": "2026-08-10T06:28:33.752820+00:00"
}
