{
  "event_id": "844db890-6fb0-49f4-950b-4eceabfac74f",
  "event_type": "capture_and_extract",
  "entity_id": "a55d1a10-02f0-46b8-8460-671b112908e1",
  "agent": "arwen-policy-etl/0.1.0",
  "input_ids": [
    "763c9fe671ac456f90dc64732241ea0451d38887c23504b16185d78a69280fa0"
  ],
  "attributes": {
    "requested_url": "https://www.icann.org/en/public-comment/upcoming-proceedings?sort-param=upcoming-date&sort-direction=asc&page=1",
    "final_url": "https://www.icann.org/en/public-comment/upcoming-proceedings?sort-param=upcoming-date&sort-direction=asc&page=1",
    "capture_status": 200,
    "etag": null,
    "last_modified": null,
    "extraction_method": "html_bs4",
    "metadata": {
      "title": "Public Comment Upcoming Proceedings",
      "language": "en",
      "summary": "View upcoming ICANN Public Comment Proceedings with high-level descriptions for topics that are under consideration, including links to relevant documents that can provide more context where applicable.",
      "published_at": null
    }
  },
  "timestamp": "2026-08-10T06:29:41.344365+00:00"
}
