{
  "event_id": "bf3fc20b-0c70-4e6f-a58d-81fb3f4dbc6f",
  "event_type": "CAPTURE_REJECTED",
  "entity_id": "591c0e473d295cc1ef5c8391",
  "agent": "arwen-policy-etl",
  "input_ids": [],
  "attributes": {
    "url": "https://www.icann.org/",
    "reason": "HTTP_403",
    "action": "NO_CAPTURE",
    "details": {
      "message": "Client error '403 Forbidden' for url 'https://www.icann.org/'\nFor more information check: https://developer.mozilla.org/en-US/docs/Web/HTTP/Status/403",
      "final_url": "https://www.icann.org/",
      "status_code": 403
    }
  },
  "timestamp": "2026-08-10T07:01:59.495456+00:00"
}