{
  "event_id": "d5d27e6f-ed88-4b43-a30c-a728ca5fc958",
  "event_type": "capture_and_extract",
  "entity_id": "87e6deec-2b5e-434a-baaa-72718151ace4",
  "agent": "arwen-policy-etl/0.1.0",
  "input_ids": [
    "02166406a8b01a4b21824a2b693f59c4a4c8e5c8c791ac2a1be90ba1e0086224"
  ],
  "attributes": {
    "requested_url": "https://www.icann.org/resources/pages/terms-conditions-2012-02-25-en",
    "final_url": "https://www.icann.org/resources/pages/fellowship-terms-conditions",
    "capture_status": 200,
    "etag": null,
    "last_modified": null,
    "extraction_method": "html_bs4",
    "metadata": {
      "title": "ICANN Fellowship Terms and Conditions - ICANN",
      "language": "en",
      "summary": null,
      "published_at": null
    }
  },
  "timestamp": "2026-08-10T06:32:29.514902+00:00"
}
