{
  "event_id": "57649b04-fabe-447e-a8c9-0d35ef624ec1",
  "event_type": "capture_and_extract",
  "entity_id": "92083864-9a70-4ffd-a94d-ab66b1c85a8c",
  "agent": "arwen-policy-etl/0.1.0",
  "input_ids": [
    "dcedad6bf91b7a35d11fef778d50aa6589eae2a1ebe13a9540e173dfa9c90f01"
  ],
  "attributes": {
    "requested_url": "https://www.icann.org/compliance/complaint",
    "final_url": "https://www.icann.org/compliance/complaint",
    "capture_status": 200,
    "etag": null,
    "last_modified": null,
    "extraction_method": "html_bs4",
    "metadata": {
      "title": "Submitting a Complaint to ICANN Contractual Compliance - ICANN",
      "language": "en",
      "summary": null,
      "published_at": null
    }
  },
  "timestamp": "2026-08-10T06:31:43.522932+00:00"
}
