{
  "event_id": "548108fb-c9d7-4e7a-959d-d34281298728",
  "event_type": "capture_and_extract",
  "entity_id": "065f00f2-2a4e-4fba-b84a-bc1af08742b1",
  "agent": "arwen-policy-etl/0.1.0",
  "input_ids": [
    "94868526ad4e0c3d8fb5bee5f2bbcecaf05a81628008221790031865ee777365"
  ],
  "attributes": {
    "requested_url": "https://www.icann.org/en/government-engagement/wsis20-outreach-network",
    "final_url": "https://www.icann.org/en/government-engagement/wsis20-outreach-network",
    "capture_status": 200,
    "etag": null,
    "last_modified": null,
    "extraction_method": "html_bs4",
    "metadata": {
      "title": "WSIS+20 Outreach Network",
      "language": "en",
      "summary": "The WSIS+20 Outreach Network brings together like-minded stakeholders to facilitate coordinated efforts leading up to the WSIS+20 negotiations in 2025.",
      "published_at": null
    }
  },
  "timestamp": "2026-08-10T06:31:49.582512+00:00"
}
