{
  "event_id": "12f8733c-077a-428f-b820-841dc76c50aa",
  "event_type": "capture_and_extract",
  "entity_id": "f8462384-3a80-4606-8ca5-b4eab9f2bd2e",
  "agent": "arwen-policy-etl/0.1.0",
  "input_ids": [
    "174a2850e95bb1795cebdcbb7cb4b67ad8e27e329249e57d59367d4c128cd5c3"
  ],
  "attributes": {
    "requested_url": "https://www.icann.org/resources/pages/what-2012-02-25-en",
    "final_url": "https://www.icann.org/resources/pages/what-2012-02-25-en",
    "capture_status": 200,
    "etag": null,
    "last_modified": null,
    "extraction_method": "html_bs4",
    "metadata": {
      "title": "What Does ICANN Do? - ICANN",
      "language": "en",
      "summary": null,
      "published_at": null
    }
  },
  "timestamp": "2026-08-10T06:32:07.839721+00:00"
}
