{
  "event_id": "3df501e6-fe10-4eed-a342-7bcd5f6e6220",
  "event_type": "capture_and_extract",
  "entity_id": "35f546d9-0e29-49e6-bd26-e6552bbd2e7e",
  "agent": "arwen-policy-etl/0.1.0",
  "input_ids": [
    "649b445c6a855131d5f1e616462cb3c673f2fcbd33fdfb777601bad3c25ff007"
  ],
  "attributes": {
    "requested_url": "https://www.icann.org/resources/pages/how-2012-02-25-en",
    "final_url": "https://www.icann.org/resources/pages/how-2012-02-25-en",
    "capture_status": 200,
    "etag": null,
    "last_modified": null,
    "extraction_method": "html_bs4",
    "metadata": {
      "title": "How do I participate? - ICANN",
      "language": "en",
      "summary": null,
      "published_at": null
    }
  },
  "timestamp": "2026-08-10T06:32:18.589370+00:00"
}
