{
  "event_id": "0a63f5d3-3cd9-4d53-ba03-c06f227373e9",
  "event_type": "CAPTURE_REJECTED",
  "entity_id": "eedb1d87754dea8ab51886b2",
  "agent": "arwen-policy-etl",
  "input_ids": [],
  "attributes": {
    "url": "https://www.intgovforum.org/en/content/dynamic-coalitions",
    "reason": "ROBOTS_UNAVAILABLE",
    "action": "NO_CAPTURE",
    "policy_source": "https://www.intgovforum.org/robots.txt",
    "details": {
      "status_code": "429"
    }
  },
  "timestamp": "2026-08-10T06:36:56.913865+00:00"
}