{
  "event_id": "a2983093-9054-475f-a46b-3c5d3c074268",
  "event_type": "capture_and_extract",
  "entity_id": "a18fff23-a7f3-4cab-bea2-d0216e7eac55",
  "agent": "arwen-policy-etl/0.1.0",
  "input_ids": [
    "e6fb4635a6dbdb5e223598ae108ab4cb8274fe1a40b028125002544d80f788d7"
  ],
  "attributes": {
    "requested_url": "https://www.icann.org/media-en",
    "final_url": "https://www.icann.org/media-en",
    "capture_status": 200,
    "etag": null,
    "last_modified": null,
    "extraction_method": "html_bs4",
    "metadata": {
      "title": "Media Resources - ICANN",
      "language": "en",
      "summary": null,
      "published_at": null
    }
  },
  "timestamp": "2026-08-10T06:29:02.029417+00:00"
}
