{
  "event_id": "419239c2-878f-41ab-b99a-d4252489d18f",
  "event_type": "capture_and_extract",
  "entity_id": "4ee0a5e9-cc0b-454b-84c8-c906e2e104bc",
  "agent": "arwen-policy-etl/0.1.0",
  "input_ids": [
    "60ea9d94c8eba588c5f473c7a182cf5d6d839348a914277dfc17f37bd0ccfa46"
  ],
  "attributes": {
    "requested_url": "https://www.itu.int/en/mediacentre/Pages/default.aspx",
    "final_url": "https://www.itu.int/en/mediacentre/Pages/default.aspx",
    "capture_status": 200,
    "etag": null,
    "last_modified": null,
    "extraction_method": "html_bs4",
    "metadata": {
      "title": "Media Centre",
      "language": "en-US",
      "summary": null,
      "published_at": null
    }
  },
  "timestamp": "2026-08-10T06:35:32.055861+00:00"
}
